{
  "schema": "perfectvoice.job.v1",
  "id": "22222222-2222-4222-8222-222222222222",
  "created_at": "2026-08-18T12:00:00Z",
  "engine_version": "0.1.0",
  "params": {
    "schema": "perfectvoice.params.v1",
    "model": "htdemucs",
    "device": "auto",
    "segment": 7.8,
    "overlap": 0.25,
    "shifts": 1,
    "vocals_only_bag": false,
    "wet": 0.85,
    "output_gain_db": 0.0,
    "mono": false,
    "sample_format": "pcm24",
    "enhancer": "none",
    "resampler_id": "soxr_hq_v1",
    "clip_policy": "no_demucs_rescale",
    "output_dir": "/path/PerfectVoice/proj/",
    "allowed_roots": ["/Volumes/Media", "/path/PerfectVoice"],
    "use_cache": true
  },
  "clips": [
    {
      "clip_id": "11111111-1111-4111-8111-111111111111",
      "input_hash": "aaaaaaaaaaaaaaaaaaaaaaaaaaaaaaaaaaaaaaaaaaaaaaaaaaaaaaaaaaaaaaaa",
      "output_path": "voice.wav",
      "output_samples": 1441440,
      "handles_left_actual": 0.4,
      "handles_right_actual": 0.5,
      "wet_dry_sample_rate": 44100,
      "peak": 0.71,
      "cache_hit": false
    }
  ]
}
